original_text,short_summary,detailed_summary
This is exactly what I was looking for. Great quality!,This is exactly what I was looking for. Great quality!,This is exactly what I was looking for. Great quality!
Excellent service and fast delivery. Highly recommended!,Excellent service and fast delivery. Highly recommended!,Excellent service and fast delivery. Highly recommended!
Mediocre experience overall. Issue with customer service.,Mediocre experience overall. Issue with customer service.,Mediocre experience overall. Issue with customer service.
Satisfactory service. Nothing to complain about. _|' Issue with technical issues.,Satisfactory service. Nothing to complain about. _|' Issue with technical issues.,Satisfactory service. Nothing to complain about. _|' Issue with technical issues.
Outstanding customer support. They resolved my issue quickly. Issue with website navigation.,Outstanding customer support. They resolved my issue quickly. Issue with website navigation.,Outstanding customer support. They resolved my issue quickly. Issue with website navigation.
It's alright. Nothing remarkable to mention. (,It's alright. Nothing remarkable to mention. (,It's alright. Nothing remarkable to mention. (
Average experience. Some good points and some bad.,Average experience. Some good points and some bad.,Average experience. Some good points and some bad.
Great value for money. Worth every penny! *] Issue with customer service.,Great value for money. Worth every penny! *] Issue with customer service.,Great value for money. Worth every penny! *] Issue with customer service.
Extremely disappointed with the quality. Not recommended.,Extremely disappointed with the quality. Not recommended.,Extremely disappointed with the quality. Not recommended.
Impressive features and functionality. Love it! ~[ Issue with delivery delays.,Impressive features and functionality. Love it! ~[ Issue with delivery delays.,Impressive features and functionality. Love it! ~[ Issue with delivery delays.
